{
  "schema": "cc.event@1.0",
  "topic": "mrktzr.score.updated",
  "timestamp": "2025-11-01T23:30:44Z",
  "source": "mrktzr",
  "env": "prod",
  "severity": "info",
  "version": "1.3.2",
  "payload": {
    "entityId": "org:acme",
    "fit": {
      "strategic": 0.92,
      "tech": 0.85,
      "geo": 0.77,
      "compliance": 0.98,
      "overall": 0.88
    },
    "risk": {
      "financial": 0.12,
      "regulatory": 0.06
    },
    "modelVersion": "score-2025.10.30",
    "explanations": [
      "High strategic alignment due to overlapping compliance services.",
      "Low financial risk from strong balance sheet."
    ]
  },
  "links": {
    "snapshot": "snapshots/prod/mrktzr/score/2025/11/01/org-acme.json"
  },
  "signature": {
    "alg": "ed25519",
    "sig": "B64-FAKE-SIGNATURE-005",
    "signer": "mrktzr-agent"
  }
}