{
  "schema": "cc.event@1.0",
  "topic": "tools.graphvis.started",
  "timestamp": "2025-11-01T23:10:12Z",
  "source": "graphvis",
  "env": "staging",
  "severity": "info",
  "version": "1.2.0",
  "payload": {
    "tool": "graphvis",
    "version": "1.2.0",
    "runner": "dagger",
    "ports": {
      "web": 4310,
      "api": 44310
    },
    "commit": "a7d8f31",
    "uptime_s": 0
  },
  "links": {
    "logs": "https://hub.local/logs/tools/graphvis",
    "traces": "https://hub.local/traces/graphvis"
  },
  "signature": {
    "alg": "ed25519",
    "sig": "B64-FAKE-SIGNATURE-001",
    "signer": "hub-signer"
  }
}